<?xml version="1.0" encoding="UTF-8"?>
<xs:schema xmlns:xs="http://www.w3.org/2001/XMLSchema">
    <!-- Declaracion de elemento RAIZ-->
    <xs:element name="almacen">
        <xs:complexType>
            <xs:sequence>
                <xs:element ref="empleados" minOccurs="1" maxOccurs="1"></xs:element>
                <xs:element ref="clientes" minOccurs="1" maxOccurs="1"></xs:element>
                <xs:element ref="pedidos" minOccurs="1" maxOccurs="1"></xs:element>
            </xs:sequence>
        </xs:complexType>
        <!-- Declaracion de claves primarias-->
        <xs:key name="pkoperario">
            <xs:selector xpath="almacen/empleados/operario" />
            <xs:field xpath="@numOpe" />
        </xs:key>
        <xs:key name="pkadministrador">
            <xs:selector xpath="almacen/empleados/administrativo" />
            <xs:field xpath="@numAdm" />
        </xs:key>
        <xs:key name="pkcliente">
            <xs:selector xpath="almacen/clientes/cliente" />
            <xs:field xpath="@numCli" />
        </xs:key>
        <xs:key name="pkpedido">
            <xs:selector xpath="./pedidos/pedido" />
            <xs:field xpath="@numPed" />
        </xs:key>
        <!-- Declaracion de claves forenea-->
        <xs:keyref name="fk_supervisor_operario" refer="pkoperario">
            <xs:selector xpath="almacen/empleados/operario" />
            <xs:field xpath="supervisor" />
        </xs:keyref>
        <xs:keyref name="fk_pedidos_operario" refer="pkoperario">
            <xs:selector xpath="almacen/pedidos/pedido" />
            <xs:field xpath="ope" />
        </xs:keyref>
        <xs:keyref name="fk_supervisor_administrador" refer="pkadministrador">
            <xs:selector xpath="almacen/empleados/administrativo" />
            <xs:field xpath="supervisor" />
        </xs:keyref>
        <xs:keyref name="fk_pedido_administrador" refer="pkadministrador">
            <xs:selector xpath="almacen/pedidos/pedido" />
            <xs:field xpath="adm" />
        </xs:keyref>
        <xs:keyref name="fk_pedido_clientes" refer="pkcliente">
            <xs:selector xpath="almacen/pedidos/pedido" />
            <xs:field xpath="cli" />
        </xs:keyref>
    </xs:element>

    <!-- Declaracion de elementos Hijos-->
    <xs:element name="empleados">
        <xs:complexType>
            <xs:sequence>
                <xs:element ref="operario" maxOccurs="unbounded"></xs:element>
                <xs:element ref="administrativo" maxOccurs="unbounded"></xs:element>
            </xs:sequence>
        </xs:complexType>
    </xs:element>

    <xs:element name="operario">
        <xs:complexType>
            <xs:sequence>
                <xs:group ref="datos"></xs:group>
                <xs:element ref="fechaNac"></xs:element>
                <xs:element ref="fechaAlt"></xs:element>
                <xs:element name="antiguedad" type="xs:string" />
                <xs:choice>
                    <xs:element name="jefe" minOccurs="0">
                        <xs:complexType></xs:complexType>
                    </xs:element>
                    <xs:element name="supervisor" minOccurs="0" type="xs:string" />
                </xs:choice>
                <xs:choice>
                    <xs:element name="expedicion" minOccurs="0">
                        <xs:complexType></xs:complexType>
                    </xs:element>
                    <xs:element name="recepcion" minOccurs="0">
                        <xs:complexType></xs:complexType>
                    </xs:element>
                </xs:choice>
            </xs:sequence>
            <xs:attribute name="numOpe" use="required" type="tiponumOpe" />
        </xs:complexType>
    </xs:element>
    <xs:element name="administrativo">
        <xs:complexType>
            <xs:sequence>
                <xs:group ref="datos"></xs:group>
                <xs:element ref="fechaNac"></xs:element>
                <xs:element ref="fechaAlt"></xs:element>
                <xs:element name="antiguedad" type="xs:string" />
                <xs:choice>
                    <xs:element name="jefe" minOccurs="0">
                        <xs:complexType></xs:complexType>
                    </xs:element>
                    <xs:element name="supervisor" minOccurs="0" type="xs:string" />
                </xs:choice>
            </xs:sequence>
            <xs:attribute name="numAdm" use="required" type="tiponumAdm" />
        </xs:complexType>
    </xs:element>

    <xs:element name="clientes">
        <xs:complexType>
            <xs:sequence>
                <xs:element name="cliente" maxOccurs="unbounded">
                    <xs:complexType>
                        <xs:sequence>
                            <xs:group ref="datos"></xs:group>
                            <xs:element name="direccion" type="xs:string" />
                            <xs:element name="telefono" type="tipoTelefono" />
                        </xs:sequence>
                        <xs:attribute name="numCli" use="required" type="tiponumCli" />
                    </xs:complexType>
                </xs:element>
            </xs:sequence>
        </xs:complexType>
    </xs:element>

    <xs:element name="pedidos">
        <xs:complexType>
            <xs:sequence>
                <xs:element name="pedido" maxOccurs="unbounded">
                    <xs:complexType>
                        <xs:sequence>
                            <xs:element name="cli" type="xs:string" />
                            <xs:element name="adm" type="xs:string" />
                            <xs:element name="ope" maxOccurs="unbounded" type="xs:string" />
                            <xs:element name="total" type="tipoTotal" />
                        </xs:sequence>
                        <xs:attribute name="numPed" type="tiponumPed" use="required" />
                    </xs:complexType>
                </xs:element>
            </xs:sequence>
        </xs:complexType>
    </xs:element>

    <xs:group name="datos">
        <xs:sequence>
            <xs:element name="nombre" type="xs:string" />
            <xs:element name="apellidos" type="xs:string" />
            <xs:element name="dni" type="tipoDNI" />
        </xs:sequence>
    </xs:group>

    <xs:group name="fecha">
        <xs:sequence>
            <xs:element name="dia" type="tipoDia" />
            <xs:element name="mes" type="tipoMes" />
            <xs:element name="anio" type="tipoAnio" />
        </xs:sequence>
    </xs:group>

    <xs:element name="fechaAlt">
        <xs:complexType>
            <xs:sequence>
                <xs:group ref="fecha"></xs:group>
            </xs:sequence>
        </xs:complexType>
    </xs:element>
    <xs:element name="fechaNac">
        <xs:complexType>
            <xs:sequence>
                <xs:group ref="fecha"></xs:group>
            </xs:sequence>
        </xs:complexType>
    </xs:element>


    <!-- Declaracion de Tipos-->

    <xs:simpleType name="tiponumOpe">
        <xs:restriction base="xs:string">
            <xs:pattern value="OP-[0-9][0-9]"></xs:pattern>
        </xs:restriction>
    </xs:simpleType>

    <xs:simpleType name="tiponumAdm">
        <xs:restriction base="xs:string">
            <xs:pattern value="ADMIN[0-9]"></xs:pattern>
        </xs:restriction>
    </xs:simpleType>

    <xs:simpleType name="tiponumCli">
        <xs:restriction base="xs:string">
            <xs:pattern value="CLI\\[0-9]{3}"></xs:pattern>
        </xs:restriction>
    </xs:simpleType>

    <xs:simpleType name="tiponumPed">
        <xs:restriction base="xs:string">
            <xs:pattern value="(PED21.|PED22.)[0-9]{2}"></xs:pattern>
        </xs:restriction>
    </xs:simpleType>

    <xs:simpleType name="tipoTelefono">
        <xs:restriction base="xs:integer">
            <xs:pattern value="[6|9][0-9]{8}"></xs:pattern>
        </xs:restriction>
    </xs:simpleType>
    <xs:simpleType name="tipoTotal">
        <xs:restriction base="xs:string">
            <xs:pattern value="[1-9][0-9]{2,3}[â‚¬]"></xs:pattern>
        </xs:restriction>
    </xs:simpleType>
    <xs:simpleType name="tipoDNI">
        <xs:restriction base="xs:string">
            <xs:pattern value="[X]?[0-9]{8}[-][A-Z]"></xs:pattern>
        </xs:restriction>
    </xs:simpleType>
    <xs:simpleType name="tipoDia">
        <xs:restriction base="xs:nonNegativeInteger">
            <xs:maxInclusive value="31"></xs:maxInclusive>
        </xs:restriction>
    </xs:simpleType>
    <xs:simpleType name="tipoMes">
        <xs:restriction base="xs:nonNegativeInteger">
            <xs:maxInclusive value="12"></xs:maxInclusive>
        </xs:restriction>
    </xs:simpleType>
    <xs:simpleType name="tipoAnio">
        <xs:restriction base="xs:integer">
            <xs:minInclusive value="1950"></xs:minInclusive>
            <xs:maxInclusive value="2022"></xs:maxInclusive>
        </xs:restriction>
    </xs:simpleType>
</xs:schema>